B1: Sail Racing Project, X-99. Sweden-344, Onyx, Team Bold Printing Group
B3: Vehicles for X-99 transportation by road
D4: Cars | K4: Trucks
B5: Brand | C5: sort | D5: Land Rover | E5: Land Rover | F5: Mercedes | G5: Chevrolet | H5: Jeep | I5: Mercedes | J5: Land Rover | K5: Volvo | L5: Scania | M5: Mercedes | N5: Volvo
B6: model | C6: sort | D6: Discovery | E6: Discovery | F6: ML 270 CDI | G6: Tahoe | H6: Grand Cherokee | I6: ML 55 AMG | J6: Range Rover | K6: FL 610 | L6: D95 | M6: Actus | N6: F611
B7: model | C7: sort | D7: ES V8 7 SEAT AUTO | E7: ES TD5 7 SEAT | G7: 5.3 L V8 PACK N | H7: 4.7 V8 OVERLAND | I7: 55 AMG | J7: 4.4 V8 VOGUE
B8: Price € (ex vat) | D8: =D9*0.09*0.8 -> 27000 | E8: =E9*0.09*0.8 -> 27000 | F8: =F9*0.09*0.8 -> 28123.200000000001 | G8: =G9*0.09*0.8 -> 34315.199999999997 | H8: =H9*0.09*0.8 -> 36259.199999999997 | I8: =I9*0.09*0.8 -> 52992 | J8: =J9*0.09*0.8 -> 63928.800000000003 | K8: =K9*0.09*0.8 -> 0 | L8: =L9*0.09*0.8 -> 0 | M8: =M9*0.09*0.8 -> 0 | N8: 5000
C9: skr (ink vat) | D9: 375000 | E9: 375000 | F9: 390600 | G9: 476600 | H9: 503600 | I9: 736000 | J9: 887900
B10: Year | D10: 2002 | E10: 2002 | F10: 2002 | G10: 2002 | H10: 2002 | I10: 2002 | J10: 2002 | K10: 1999 | L10: 2002 | M10: 2002 | N10: 1977
B11: Drivhjul | D11: 4x4 | E11: 4x4 | F11: 4x4 | G11: 4x4 | H11: 4x4 | I11: 4x4 | J11: 4x4 | K11: 2x4 | L11: 2x4 | M11: 2x4 | N11: 2x4
B12: Fuel | D12: unleaded | E12: diesel | F12: diesel | G12: unleaded | H12: unleaded | I12: unleaded | J12: unleaded | K12: diesel | L12: diesel | M12: diesel | N12: diesel
B13: Displacement CCM | C13: cc | D13: 3950 | E13: 2495 | F13: 2685 | G13: 5327 | H13: 4701 | I13: 5439 | J13: 4398 | L13: 9000
B14: Power | C14: hk | D14: 184 | E14: 138 | F14: 163 | G14: 273 | H14: 258 | I14: 347 | J14: 282 | K14: 180 | L14: 220 | N14: 88
C15: kW | D15: 136 | E15: 102 | F15: 120 | G15: 201 | H15: 190 | I15: 255 | J15: 210 | K15: 132 | N15: 120
B16: Torque | C16: Nm | D16: 340 | E16: 300 | F16: 370 | G16: 427 | H16: 425 | I16: 510 | J16: 440 | K16: 550 | L16: 1005 | N16: 365
B17: Cylinders | D17: 8 | E17: 5 | F17: 5 | G17: 8 | H17: 8 | I17: 8 | J17: 8 | K17: 6 | L17: 6 | M17: 6 | N17: 6
B18: Gears | D18: 4 | E18: 5 | F18: 6 | G18: 4 | H18: 5 | I18: 5 | J18: 5
B19: Acceleration 0-100 km/h | C19: sek | D19: 11.7 | E19: 15.3 | F19: 11.9 | H19: 7.9 | I19: 6.8 | J19: 9.2
B20: Top Speed | C20: km/h | D20: 170 | E20: 157 | F20: 185 | G20: 170 | H20: 206 | I20: 235 | J20: 208
B21: Fuel economy City | C21: l/100km | D21: 22.9 | E21: 11.5 | F21: 12.5 | G21: 20.3 | H21: 22.3 | I21: 20.6 | J21: 22.2
B22: High Way 90km/h | D22: 13.1 | E22: 8 | F22: 7.7 | G22: 11.7 | H22: 13 | I22: 11.4 | J22: 12.6
B23: Mixed EU | D23: 16.7 | E23: 9.4 | F23: 9.4 | G23: 14.8 | H23: 16.5 | I23: 14.8 | J23: 16.2
B25: Kompressionsförhållande | D25: 9.4:1 | E25: 19.5:1 | G25: 9.5:1 | H25: 9.3:1 | I25: 10.5:1 | J25: 0.41736111111111113 | L25: 0.75069444444444444
B26: Gear box | D26: automatic | E26: manual | F26: manuell | G26: automatic | H26: automatic | I26: automatic | J26: automat
B27: Fälg bak | D27: 8x16" | E27: 8x16" | F27: 8x17" | G27: 7x16" | H27: 7x17" | I27: 9x18" | J27: 7.5x19"
B28: Fälg fram | D28: 8x16" | E28: 8x16" | F28: 8x17" | G28: 7x16" | H28: 7x17" | I28: 9x18" | J28: 7.5x19"
B29: Däck bak | D29: 255/60-16 | E29: 255/60-16 | F29: 255/60-17 | G29: 265/70-16 | H29: 235/65-17 | I29: 285/50-18 | J29: 255/55-19
B30: Däck fram | D30: 255/60-16 | E30: 255/60-16 | F30: 255/60-17 | G30: 265/70-16 | H30: 235/65-17 | I30: 285/50-18 | J30: 255/55-19
B31: Seats | D31: 7 | E31: 7 | F31: 5 | G31: 5 | H31: 5 | I31: 5 | J31: 5
B32: Tjänstevikt | D32: 2205 | E32: 2205 | F32: 2175 | G32: 2419 | I32: 2325 | J32: 2440 | K32: 3740 | N32: 5220
B33: Lastförmåga | K33: 6060 | N33: 5780
B34: Total weigt | K34: 9800 | N34: 11000
B35: Trailer weight | C35: kg | D35: 3500 | E35: 3500 | F35: 3500 | G35: 3500 | H35: 3500 | I35: 3500 | K35: 8200 | N35: 5000
B36: Axelavstånd | C36: mm | D36: 2540 | E36: 2540 | F36: 2820 | G36: 2946 | H36: 2691 | I36: 2820 | J36: 2880
B37: Spårvidd fram / bak | C37: mm | D37: 1540 / 1560 | E37: 1540 / 1560 | F37: 1565 / 1565 | G37: 1651 / 1676 | H37: 1511 / 1511 | I37: 1555 / 1555 | J37: 1629 / 1626 | N37: 2490
N38: 2490
B39: Dimensio length | C39: mm | D39: 4705 | E39: 4705 | F39: 4587 | G39: 5052 | H39: 4613 | I39: 4635 | J39: 4950 | N39: 7300
B40: beam | D40: 2190 | E40: 2190 | F40: 1833 | G40: 2068 | H40: 1858 | I40: 1895 | J40: 1956
B41: hight | D41: 1980 | E41: 1980 | F41: 1776 | G41: 1960 | H41: 1805 | I41: 1804 | J41: 1863
B42: Takhöjd fram / bak | C42: mm | D42: 1031 / 1043 | E42: 1031 / 1043 | F42: 1010 / 1008 | G42: 1013 / 988 | H42: 1008 / 1004 | I42: 1010 / 1008 | L42: 1513
B43: Benutrymme fram / bak | C43: mm | D43: 963 / 842 | E43: 963 / 842 | F43: 1024 / 966 | G43: 1059 / 925 | H43: 1052 / 897 | I43: 1024 / 966
B44: Sittbredd fram / bak | C44: mm | F44: 1493 / 1488 | G44: 1521 / 1516 | H44: 1435 / 1330 | I44: 1493 / 1488 | L44: 2125
B45: Axelbredd fram / bak | C45: mm | D45: 1395 / 1390 | E45: 1395 / 1390 | F45: 1478 / 1468 | G45: 1643 / 1646 | H45: 1496 / 1468 | I45: 1478 / 1468